{
  "components": [
    {
      "boundary_note": "Semantic projection only; does not grant ownership, authority, execution, or verification rights.",
      "classification_basis": "name/path heuristic over observed source binding; does not grant canonical semantic ownership",
      "component_class": "package",
      "component_id": "ag:component:agent-eval",
      "epistemic_status": "INFERRED",
      "evidence_refs": [
        "github://Aftergraph/runtime@45d1d95282ca0cb6926c49ce43847884e2eaae43/packages/agent-eval/package.json"
      ],
      "legacy": false,
      "name": "@aftergraph/agent-eval",
      "owns_semantic_family": false,
      "semantic_family": "WITNESS",
      "source_repositories": [
        "Aftergraph/runtime"
      ]
    },
    {
      "boundary_note": "Semantic projection only; does not grant ownership, authority, execution, or verification rights.",
      "classification_basis": "name/path heuristic over observed source binding; does not grant canonical semantic ownership",
      "component_class": "package",
      "component_id": "ag:component:agent-harness",
      "epistemic_status": "INFERRED",
      "evidence_refs": [
        "github://Aftergraph/runtime@45d1d95282ca0cb6926c49ce43847884e2eaae43/packages/agent-harness/package.json"
      ],
      "legacy": false,
      "name": "@aftergraph/agent-harness",
      "owns_semantic_family": false,
      "semantic_family": "WITNESS",
      "source_repositories": [
        "Aftergraph/runtime"
      ]
    },
    {
      "boundary_note": "Semantic projection only; does not grant ownership, authority, execution, or verification rights.",
      "classification_basis": "name/path heuristic over observed source binding; does not grant canonical semantic ownership",
      "component_class": "package",
      "component_id": "ag:component:agent-relay",
      "epistemic_status": "INFERRED",
      "evidence_refs": [
        "github://Aftergraph/runtime@45d1d95282ca0cb6926c49ce43847884e2eaae43/packages/agent-relay/package.json"
      ],
      "legacy": false,
      "name": "@aftergraph/agent-relay",
      "owns_semantic_family": false,
      "semantic_family": "DRIVE",
      "source_repositories": [
        "Aftergraph/runtime"
      ]
    },
    {
      "boundary_note": "Semantic projection only; does not grant ownership, authority, execution, or verification rights.",
      "classification_basis": "explicit component/repository role in current governance topology",
      "component_class": "project",
      "component_id": "ag:component:atlas",
      "epistemic_status": "DECLARED",
      "evidence_refs": [
        "github://Aftergraph/aftergraph.org@34ae4ee547f02233ae4a6f3159309d3adebeeaf8/atlas/package.json"
      ],
      "legacy": false,
      "name": "aftergraph-atlas",
      "owns_semantic_family": false,
      "semantic_family": "EXPERIENCE",
      "source_repositories": [
        "Aftergraph/aftergraph.org"
      ]
    },
    {
      "boundary_note": "Semantic support classification only; does not grant authority or replace AIE.",
      "classification_basis": "name/path heuristic over observed source binding; does not grant canonical semantic ownership",
      "component_class": "package",
      "component_id": "ag:component:authorization",
      "epistemic_status": "INFERRED",
      "evidence_refs": [
        "github://Aftergraph/runtime@45d1d95282ca0cb6926c49ce43847884e2eaae43/packages/authorization/package.json"
      ],
      "legacy": false,
      "name": "@aftergraph/authorization",
      "owns_semantic_family": false,
      "semantic_family": "COVENANT_SUPPORT",
      "source_repositories": [
        "Aftergraph/runtime"
      ]
    },
    {
      "boundary_note": "Semantic projection only; does not grant ownership, authority, execution, or verification rights.",
      "classification_basis": "explicit component/repository role in current governance topology",
      "component_class": "package",
      "component_id": "ag:component:brand",
      "epistemic_status": "DECLARED",
      "evidence_refs": [
        "github://Aftergraph/brand@6abc51be903ffd1041a716d2adeec364de3d68c0/package.json",
        "github://Aftergraph/studio@9979875f7875cfdf89f9577e69d25b6f10731e75/packages/brand/package.json"
      ],
      "legacy": false,
      "name": "@aftergraph/brand",
      "owns_semantic_family": false,
      "semantic_family": "COMMONS",
      "source_repositories": [
        "Aftergraph/brand",
        "Aftergraph/studio"
      ]
    },
    {
      "boundary_note": "Semantic projection only; does not grant ownership, authority, execution, or verification rights.",
      "classification_basis": "explicit component/repository role in current governance topology",
      "component_class": "package",
      "component_id": "ag:component:business-ops",
      "epistemic_status": "DECLARED",
      "evidence_refs": [
        "github://Aftergraph/business-ops@7148f733fbe74acc5279860c1fbc1fb9235ead21/package.json"
      ],
      "legacy": false,
      "name": "@aftergraph/business-ops",
      "owns_semantic_family": false,
      "semantic_family": "DOMAIN",
      "source_repositories": [
        "Aftergraph/business-ops"
      ]
    },
    {
      "boundary_note": "Semantic support classification only; does not grant authority or replace AIE.",
      "classification_basis": "name/path heuristic over observed source binding; does not grant canonical semantic ownership",
      "component_class": "package",
      "component_id": "ag:component:constitution",
      "epistemic_status": "INFERRED",
      "evidence_refs": [
        "github://Aftergraph/runtime@45d1d95282ca0cb6926c49ce43847884e2eaae43/packages/constitution/package.json"
      ],
      "legacy": false,
      "name": "@aftergraph/constitution",
      "owns_semantic_family": false,
      "semantic_family": "COVENANT_SUPPORT",
      "source_repositories": [
        "Aftergraph/runtime"
      ]
    },
    {
      "boundary_note": "Semantic projection only; does not grant ownership, authority, execution, or verification rights.",
      "classification_basis": "name/path heuristic over observed source binding; does not grant canonical semantic ownership",
      "component_class": "package",
      "component_id": "ag:component:contracts",
      "epistemic_status": "INFERRED",
      "evidence_refs": [
        "github://Aftergraph/runtime@45d1d95282ca0cb6926c49ce43847884e2eaae43/packages/contracts/package.json"
      ],
      "legacy": false,
      "name": "@aftergraph/contracts",
      "owns_semantic_family": false,
      "semantic_family": "COMMONS",
      "source_repositories": [
        "Aftergraph/runtime"
      ]
    },
    {
      "boundary_note": "Semantic projection only; does not grant ownership, authority, execution, or verification rights.",
      "classification_basis": "name/path heuristic over observed source binding; does not grant canonical semantic ownership",
      "component_class": "package",
      "component_id": "ag:component:definitions",
      "epistemic_status": "INFERRED",
      "evidence_refs": [
        "github://Aftergraph/runtime@45d1d95282ca0cb6926c49ce43847884e2eaae43/packages/definitions/package.json"
      ],
      "legacy": false,
      "name": "@aftergraph/definitions",
      "owns_semantic_family": false,
      "semantic_family": "COMMONS",
      "source_repositories": [
        "Aftergraph/runtime"
      ]
    },
    {
      "boundary_note": "Semantic projection only; does not grant ownership, authority, execution, or verification rights.",
      "classification_basis": "explicit component/repository role in current governance topology",
      "component_class": "package",
      "component_id": "ag:component:docs",
      "epistemic_status": "DECLARED",
      "evidence_refs": [
        "github://Aftergraph/docs@a3ca2292a6926b055d54d3fc2df325a7e59814cd/package.json"
      ],
      "legacy": false,
      "name": "@aftergraph/docs",
      "owns_semantic_family": false,
      "semantic_family": "COMMONS",
      "source_repositories": [
        "Aftergraph/docs"
      ]
    },
    {
      "boundary_note": "Semantic projection only; does not grant ownership, authority, execution, or verification rights.",
      "classification_basis": "name/path heuristic over observed source binding; does not grant canonical semantic ownership",
      "component_class": "package",
      "component_id": "ag:component:events",
      "epistemic_status": "INFERRED",
      "evidence_refs": [
        "github://Aftergraph/runtime@45d1d95282ca0cb6926c49ce43847884e2eaae43/packages/events/package.json"
      ],
      "legacy": false,
      "name": "@aftergraph/events",
      "owns_semantic_family": false,
      "semantic_family": "DRIVE",
      "source_repositories": [
        "Aftergraph/runtime"
      ]
    },
    {
      "boundary_note": "Semantic projection only; does not grant ownership, authority, execution, or verification rights.",
      "classification_basis": "name/path heuristic over observed source binding; does not grant canonical semantic ownership",
      "component_class": "package",
      "component_id": "ag:component:goals",
      "epistemic_status": "INFERRED",
      "evidence_refs": [
        "github://Aftergraph/runtime@45d1d95282ca0cb6926c49ce43847884e2eaae43/packages/goals/package.json"
      ],
      "legacy": false,
      "name": "@aftergraph/goals",
      "owns_semantic_family": false,
      "semantic_family": "HELM",
      "source_repositories": [
        "Aftergraph/runtime"
      ]
    },
    {
      "boundary_note": "Semantic projection only; does not grant ownership, authority, execution, or verification rights.",
      "classification_basis": "name/path heuristic over observed source binding; does not grant canonical semantic ownership",
      "component_class": "package",
      "component_id": "ag:component:heartbeat",
      "epistemic_status": "INFERRED",
      "evidence_refs": [